{
  "$schema": "./visual_assets.schema.json",
  "schema_version": 1,
  "catalog_version": "visual-assets-v2",
  "size_tokens": {
    "xs": 12,
    "sm": 16,
    "md": 20,
    "lg": 24,
    "xl": 32,
    "2xl": 48
  },
  "assets": [
    {
      "id": "whatsapp",
      "label": "WhatsApp",
      "category": "contact",
      "kind": "brand",
      "tabler": "IconBrandWhatsapp",
      "tabler_filled": "IconBrandWhatsappFilled",
      "svg": "/assets/icons/light/brands/whatsapp.svg",
      "svg_filled": "/assets/icons/light/brands/whatsapp-filled.svg",
      "brand_color": "#25D366",
      "aliases": [
        "wa"
      ],
      "svg_light": "/assets/icons/light/brands/whatsapp.svg",
      "svg_dark": "/assets/icons/dark/brands/whatsapp.svg",
      "svg_filled_light": "/assets/icons/light/brands/whatsapp-filled.svg",
      "svg_filled_dark": "/assets/icons/dark/brands/whatsapp-filled.svg"
    },
    {
      "id": "telegram",
      "label": "Telegram",
      "category": "contact",
      "kind": "brand",
      "tabler": "IconBrandTelegram",
      "svg": "/assets/icons/light/brands/telegram.svg",
      "brand_color": "#26A5E4",
      "aliases": [
        "tg"
      ],
      "svg_light": "/assets/icons/light/brands/telegram.svg",
      "svg_dark": "/assets/icons/dark/brands/telegram.svg"
    },
    {
      "id": "viber",
      "label": "Viber",
      "category": "contact",
      "kind": "brand",
      "svg": "/assets/icons/light/brands/viber.svg",
      "brand_color": "#7360F2",
      "svg_light": "/assets/icons/light/brands/viber.svg",
      "svg_dark": "/assets/icons/dark/brands/viber.svg"
    },
    {
      "id": "phone",
      "label": "Phone",
      "category": "contact",
      "kind": "glyph",
      "tabler": "IconPhone",
      "svg": "/assets/icons/light/contact/phone.svg",
      "svg_light": "/assets/icons/light/contact/phone.svg",
      "svg_dark": "/assets/icons/dark/contact/phone.svg"
    },
    {
      "id": "email",
      "label": "Email",
      "category": "contact",
      "kind": "glyph",
      "tabler": "IconMail",
      "svg": "/assets/icons/light/contact/email.svg",
      "aliases": [
        "mail"
      ],
      "svg_light": "/assets/icons/light/contact/email.svg",
      "svg_dark": "/assets/icons/dark/contact/email.svg"
    },
    {
      "id": "sms",
      "label": "SMS",
      "category": "contact",
      "kind": "glyph",
      "tabler": "IconMessage",
      "svg": "/assets/icons/light/contact/sms.svg",
      "svg_light": "/assets/icons/light/contact/sms.svg",
      "svg_dark": "/assets/icons/dark/contact/sms.svg"
    },
    {
      "id": "meta",
      "label": "Meta",
      "category": "source",
      "kind": "brand",
      "tabler": "IconBrandMeta",
      "svg": "/assets/icons/light/brands/meta.svg",
      "brand_color": "#0081FB",
      "svg_light": "/assets/icons/light/brands/meta.svg",
      "svg_dark": "/assets/icons/dark/brands/meta.svg"
    },
    {
      "id": "facebook",
      "label": "Facebook",
      "category": "source",
      "kind": "brand",
      "tabler": "IconBrandFacebook",
      "tabler_filled": "IconBrandFacebookFilled",
      "svg": "/assets/icons/light/brands/facebook.svg",
      "svg_filled": "/assets/icons/light/brands/facebook-filled.svg",
      "brand_color": "#1877F2",
      "svg_light": "/assets/icons/light/brands/facebook.svg",
      "svg_dark": "/assets/icons/dark/brands/facebook.svg",
      "svg_filled_light": "/assets/icons/light/brands/facebook-filled.svg",
      "svg_filled_dark": "/assets/icons/dark/brands/facebook-filled.svg"
    },
    {
      "id": "google",
      "label": "Google",
      "category": "source",
      "kind": "brand",
      "tabler": "IconBrandGoogle",
      "tabler_filled": "IconBrandGoogleFilled",
      "svg": "/assets/icons/light/brands/google.svg",
      "brand_color": "#4285F4",
      "svg_light": "/assets/icons/light/brands/google.svg",
      "svg_dark": "/assets/icons/dark/brands/google.svg"
    },
    {
      "id": "tiktok",
      "label": "TikTok",
      "category": "source",
      "kind": "brand",
      "tabler": "IconBrandTiktok",
      "tabler_filled": "IconBrandTiktokFilled",
      "svg": "/assets/icons/light/brands/tiktok.svg",
      "brand_color": "#000000",
      "svg_light": "/assets/icons/light/brands/tiktok.svg",
      "svg_dark": "/assets/icons/dark/brands/tiktok.svg"
    },
    {
      "id": "linkedin",
      "label": "LinkedIn",
      "category": "source",
      "kind": "brand",
      "tabler": "IconBrandLinkedin",
      "tabler_filled": "IconBrandLinkedinFilled",
      "svg": "/assets/icons/light/brands/linkedin.svg",
      "svg_filled": "/assets/icons/light/brands/linkedin-filled.svg",
      "brand_color": "#0A66C2",
      "svg_light": "/assets/icons/light/brands/linkedin.svg",
      "svg_dark": "/assets/icons/dark/brands/linkedin.svg",
      "svg_filled_light": "/assets/icons/light/brands/linkedin-filled.svg",
      "svg_filled_dark": "/assets/icons/dark/brands/linkedin-filled.svg"
    },
    {
      "id": "instagram",
      "label": "Instagram",
      "category": "source",
      "kind": "brand",
      "tabler": "IconBrandInstagram",
      "tabler_filled": "IconBrandInstagramFilled",
      "svg": "/assets/icons/light/brands/instagram.svg",
      "brand_color": "#E4405F",
      "svg_light": "/assets/icons/light/brands/instagram.svg",
      "svg_dark": "/assets/icons/dark/brands/instagram.svg"
    },
    {
      "id": "x",
      "label": "X",
      "category": "source",
      "kind": "brand",
      "tabler": "IconBrandX",
      "svg": "/assets/icons/light/brands/x.svg",
      "brand_color": "#000000",
      "aliases": [
        "twitter"
      ],
      "svg_light": "/assets/icons/light/brands/x.svg",
      "svg_dark": "/assets/icons/dark/brands/x.svg"
    },
    {
      "id": "vk",
      "label": "VK",
      "category": "source",
      "kind": "brand",
      "tabler": "IconBrandVk",
      "svg": "/assets/icons/light/brands/vk.svg",
      "brand_color": "#0077FF",
      "svg_light": "/assets/icons/light/brands/vk.svg",
      "svg_dark": "/assets/icons/dark/brands/vk.svg"
    },
    {
      "id": "referral",
      "label": "Referral",
      "category": "source",
      "kind": "glyph",
      "tabler": "IconUsers",
      "svg": "/assets/icons/light/source/referral.svg",
      "svg_light": "/assets/icons/light/source/referral.svg",
      "svg_dark": "/assets/icons/dark/source/referral.svg"
    },
    {
      "id": "website",
      "label": "Website",
      "category": "source",
      "kind": "glyph",
      "tabler": "IconWorld",
      "svg": "/assets/icons/light/source/website.svg",
      "aliases": [
        "web",
        "direct"
      ],
      "svg_light": "/assets/icons/light/source/website.svg",
      "svg_dark": "/assets/icons/dark/source/website.svg"
    },
    {
      "id": "webhook",
      "label": "Webhook",
      "category": "source",
      "kind": "glyph",
      "tabler": "IconWebhook",
      "svg": "/assets/icons/light/source/webhook.svg",
      "svg_light": "/assets/icons/light/source/webhook.svg",
      "svg_dark": "/assets/icons/dark/source/webhook.svg"
    },
    {
      "id": "flag-pl",
      "label": "Poland",
      "category": "flag",
      "kind": "flag",
      "svg": "/assets/icons/light/flags/pl.svg",
      "aliases": [
        "pl"
      ],
      "svg_light": "/assets/icons/light/flags/pl.svg",
      "svg_dark": "/assets/icons/dark/flags/pl.svg"
    },
    {
      "id": "flag-de",
      "label": "Germany",
      "category": "flag",
      "kind": "flag",
      "svg": "/assets/icons/light/flags/de.svg",
      "aliases": [
        "de"
      ],
      "svg_light": "/assets/icons/light/flags/de.svg",
      "svg_dark": "/assets/icons/dark/flags/de.svg"
    },
    {
      "id": "flag-ua",
      "label": "Ukraine",
      "category": "flag",
      "kind": "flag",
      "svg": "/assets/icons/light/flags/ua.svg",
      "aliases": [
        "ua"
      ],
      "svg_light": "/assets/icons/light/flags/ua.svg",
      "svg_dark": "/assets/icons/dark/flags/ua.svg"
    },
    {
      "id": "flag-by",
      "label": "Belarus",
      "category": "flag",
      "kind": "flag",
      "svg": "/assets/icons/light/flags/by.svg",
      "aliases": [
        "by"
      ],
      "svg_light": "/assets/icons/light/flags/by.svg",
      "svg_dark": "/assets/icons/dark/flags/by.svg"
    },
    {
      "id": "flag-cz",
      "label": "Czechia",
      "category": "flag",
      "kind": "flag",
      "svg": "/assets/icons/light/flags/cz.svg",
      "aliases": [
        "cz"
      ],
      "svg_light": "/assets/icons/light/flags/cz.svg",
      "svg_dark": "/assets/icons/dark/flags/cz.svg"
    },
    {
      "id": "flag-lt",
      "label": "Lithuania",
      "category": "flag",
      "kind": "flag",
      "svg": "/assets/icons/light/flags/lt.svg",
      "aliases": [
        "lt"
      ],
      "svg_light": "/assets/icons/light/flags/lt.svg",
      "svg_dark": "/assets/icons/dark/flags/lt.svg"
    },
    {
      "id": "flag-lv",
      "label": "Latvia",
      "category": "flag",
      "kind": "flag",
      "svg": "/assets/icons/light/flags/lv.svg",
      "aliases": [
        "lv"
      ],
      "svg_light": "/assets/icons/light/flags/lv.svg",
      "svg_dark": "/assets/icons/dark/flags/lv.svg"
    },
    {
      "id": "flag-ee",
      "label": "Estonia",
      "category": "flag",
      "kind": "flag",
      "svg": "/assets/icons/light/flags/ee.svg",
      "aliases": [
        "ee"
      ],
      "svg_light": "/assets/icons/light/flags/ee.svg",
      "svg_dark": "/assets/icons/dark/flags/ee.svg"
    },
    {
      "id": "flag-ro",
      "label": "Romania",
      "category": "flag",
      "kind": "flag",
      "svg": "/assets/icons/light/flags/ro.svg",
      "aliases": [
        "ro"
      ],
      "svg_light": "/assets/icons/light/flags/ro.svg",
      "svg_dark": "/assets/icons/dark/flags/ro.svg"
    },
    {
      "id": "flag-md",
      "label": "Moldova",
      "category": "flag",
      "kind": "flag",